{
  "schemaVersion": "consensus-sanity.v1",
  "asOf": "2026-07-22",
  "methodology": "Dated, defeasible priors for retention-or-exclusion tests. Inclusion is not a rank, fit result, artifact endorsement, or universal recommendation.",
  "sources": [
    { "id": "qwen3-card", "title": "Qwen2.5-Coder-3B-Instruct model card", "publisher": "Qwen", "url": "https://huggingface.co/Qwen/Qwen2.5-Coder-3B-Instruct", "sourceClass": "vendor-model-card", "publishedAt": "2025-01-12", "retrievedAt": "2026-07-22", "supports": ["The 3B instruction model is a code-specialized candidate family."] },
    { "id": "qwen7-card", "title": "Qwen2.5-Coder-7B-Instruct model card", "publisher": "Qwen", "url": "https://huggingface.co/Qwen/Qwen2.5-Coder-7B-Instruct", "sourceClass": "vendor-model-card", "publishedAt": "2025-01-12", "retrievedAt": "2026-07-22", "supports": ["The 7B instruction model is code-specialized and advertises long context with deployment caveats."] },
    { "id": "qwen14-card", "title": "Qwen2.5-Coder-14B-Instruct model card", "publisher": "Qwen", "url": "https://huggingface.co/Qwen/Qwen2.5-Coder-14B-Instruct", "sourceClass": "vendor-model-card", "publishedAt": "2025-01-12", "retrievedAt": "2026-07-22", "supports": ["The 14B code model defaults to 32768 tokens; longer context needs explicit YaRN configuration."] },
    { "id": "qwen32-card", "title": "Qwen2.5-Coder-32B-Instruct model card", "publisher": "Qwen", "url": "https://huggingface.co/Qwen/Qwen2.5-Coder-32B-Instruct", "sourceClass": "vendor-model-card", "publishedAt": "2025-01-12", "retrievedAt": "2026-07-22", "supports": ["The 32B instruction model is code-specialized; local use still requires exact quantization and fit evidence."] },
    { "id": "qwen3-gguf", "title": "Official Qwen2.5-Coder-3B-Instruct GGUF revision", "publisher": "Qwen", "url": "https://huggingface.co/Qwen/Qwen2.5-Coder-3B-Instruct-GGUF/tree/f74adce6aa16316c625447af059dbebe4983757c", "sourceClass": "vendor-model-card", "publishedAt": null, "retrievedAt": "2026-07-22", "supports": ["An official revision-pinned GGUF conversion exists for exact-artifact follow-up."] },
    { "id": "gemma4-card", "title": "Gemma 3 4B IT model card", "publisher": "Google", "url": "https://huggingface.co/google/gemma-3-4b-it", "sourceClass": "vendor-model-card", "publishedAt": "2025-03-12", "retrievedAt": "2026-07-22", "supports": ["Gemma 3 4B IT lists summarization and text generation and advertises 128K input context."] },
    { "id": "phi4-card", "title": "Phi-4-mini-instruct model card", "publisher": "Microsoft", "url": "https://huggingface.co/microsoft/Phi-4-mini-instruct", "sourceClass": "vendor-model-card", "publishedAt": "2025-02-26", "retrievedAt": "2026-07-22", "supports": ["Phi-4 mini is 3.8B and intended partly for constrained and latency-bound use."] },
    { "id": "mlx-docs", "title": "MLX LM README", "publisher": "MLX team", "url": "https://github.com/ml-explore/mlx-lm", "sourceClass": "runtime-documentation", "publishedAt": null, "retrievedAt": "2026-07-22", "supports": ["MLX LM runs and quantizes language models on Apple silicon."] },
    { "id": "llamacpp-docs", "title": "llama.cpp README", "publisher": "ggml-org", "url": "https://github.com/ggml-org/llama.cpp", "sourceClass": "runtime-documentation", "publishedAt": null, "retrievedAt": "2026-07-22", "supports": ["llama.cpp supports CPU plus GPU hybrid inference and compatible GGUF artifacts."] },
    { "id": "community-6gb", "title": "What can I do with 6GB of VRAM?", "publisher": "r/LocalLLaMA contributors", "url": "https://www.reddit.com/r/LocalLLaMA/comments/1hzi6ed/what_can_i_do_with_6gb_of_vram/", "sourceClass": "community-discussion", "publishedAt": "2025-01-12", "retrievedAt": "2026-07-22", "supports": ["Contributors consider Qwen2.5 Coder 3B and quantized 7B on 6GB and report larger offloaded models as slower."] },
    { "id": "community-24gb", "title": "Models that can fit in 24GB VRAM", "publisher": "r/LocalLLaMA contributor", "url": "https://www.reddit.com/r/LocalLLaMA/comments/1i8tx5z/i_benchmarked_almost_every_model_that_can_fit_in/", "sourceClass": "community-discussion", "publishedAt": "2025-01-24", "retrievedAt": "2026-07-22", "supports": ["A high-attention benchmark treats quantized Qwen2.5 Coder 32B as a candidate but explicitly omitted coding tasks."] },
    { "id": "community-apple16", "title": "Apple Silicon 16GB model recommendation discussion", "publisher": "r/LocalLLM contributors", "url": "https://www.reddit.com/r/LocalLLM/comments/1shmkgu/what_model_should_i_use_on_an_apple_silicon/", "sourceClass": "community-discussion", "publishedAt": "2026-04-10", "retrievedAt": "2026-07-22", "supports": ["Contributors support small quantized models but disagree about capability and safe context headroom on 16GB."] }
  ],
  "scenarios": [
    {
      "id": "nvidia-6gb-interactive-coding", "status": "sourced-prior",
      "hardware": { "acceleratorKind": "discrete-gpu", "vendor": "nvidia", "acceleratorMemoryGiB": 6, "systemMemoryGiB": 16, "memoryConfirmation": "self-reported" },
      "task": { "kind": "coding", "contextTargetTokens": 8192, "priority": "balanced", "latencyPreference": "interactive" },
      "assumptions": { "runtime": "llama.cpp-compatible", "backend": "cuda", "offload": "partial-allowed", "notes": ["System RAM matters because hybrid offload changes feasibility and speed.", "Context target is an input, not the model-card maximum."] },
      "mustConsider": [
        { "id": "qwen3-q4", "modelFamily": "Qwen2.5 Coder 3B Instruct", "upstreamModel": "Qwen/Qwen2.5-Coder-3B-Instruct", "artifactRequirement": "revision-pinned GGUF, Q4-class candidate", "runtimeRequirement": "identified llama.cpp build with CUDA backend", "considerationReason": "Code specialization, an official pinned GGUF route and community reports make this a strong small-model prior.", "sourceIds": ["qwen3-card", "qwen3-gguf", "community-6gb"], "identityCompleteness": "family-prior-exact-artifact-unresolved" },
        { "id": "qwen7-q4", "modelFamily": "Qwen2.5 Coder 7B Instruct", "upstreamModel": "Qwen/Qwen2.5-Coder-7B-Instruct", "artifactRequirement": "revision-pinned GGUF, Q4-class candidate", "runtimeRequirement": "identified llama.cpp build; offload measured", "considerationReason": "Code specialization and repeated community consideration justify retaining or explicitly excluding it after fit evaluation.", "sourceIds": ["qwen7-card", "community-6gb", "llamacpp-docs"], "identityCompleteness": "family-prior-exact-artifact-unresolved" }
      ],
      "mustNotRecommend": [
        { "code": "NO_UNPROVEN_FULL_GPU_FIT", "rule": "Do not label 7B fully GPU-resident until weights, buffers, KV cache and machine reserve fit.", "sourceIds": ["llamacpp-docs"] },
        { "code": "NO_CONTEXT_CEILING_AS_FIT", "rule": "Do not equate advertised maximum context with an interactive 8192-token configuration on this device.", "sourceIds": ["qwen7-card"] },
        { "code": "NO_SLOW_OFFLOAD_AS_INTERACTIVE", "rule": "Do not recommend a larger CPU-offloaded model for interactive use without exact latency evidence.", "sourceIds": ["community-6gb", "llamacpp-docs"] }
      ],
      "disagreements": ["Reports disagree on whether 7B Q4 stays interactive after context and desktop reserve.", "A 3B candidate may be faster but adequacy must be auditioned."],
      "evaluationRule": "Each candidate must survive exact fit evaluation or produce a stable exclusion code; neither must rank first."
    },
    {
      "id": "discrete-12gb-project-coding", "status": "sourced-prior",
      "hardware": { "acceleratorKind": "discrete-gpu", "vendor": "nvidia", "acceleratorMemoryGiB": 12, "systemMemoryGiB": 32, "memoryConfirmation": "self-reported" },
      "task": { "kind": "coding", "contextTargetTokens": 16384, "priority": "long-context", "latencyPreference": "interactive" },
      "assumptions": { "runtime": "llama.cpp-compatible", "backend": "cuda", "offload": "partial-allowed", "notes": ["Project context makes KV-cache settings first-class fit inputs.", "The 14B case is conditional, not presumed resident."] },
      "mustConsider": [
        { "id": "qwen7-project", "modelFamily": "Qwen2.5 Coder 7B Instruct", "upstreamModel": "Qwen/Qwen2.5-Coder-7B-Instruct", "artifactRequirement": "revision-pinned GGUF with declared quantization", "runtimeRequirement": "identified llama.cpp build and CUDA settings", "considerationReason": "The code-specialized 7B family supplies a lower-memory baseline against which larger candidates justify cost.", "sourceIds": ["qwen7-card", "llamacpp-docs"], "identityCompleteness": "family-prior-exact-artifact-unresolved" },
        { "id": "qwen14-project", "modelFamily": "Qwen2.5 Coder 14B Instruct", "upstreamModel": "Qwen/Qwen2.5-Coder-14B-Instruct", "artifactRequirement": "revision-pinned GGUF selected by exact fit", "runtimeRequirement": "identified llama.cpp build; partial offload measured", "considerationReason": "The larger code family is a quality candidate only if fit and interactive latency survive the 16K target.", "sourceIds": ["qwen14-card", "llamacpp-docs"], "identityCompleteness": "family-prior-exact-artifact-unresolved" }
      ],
      "mustNotRecommend": [
        { "code": "NO_YARN_BY_DEFAULT", "rule": "Do not silently enable long-context scaling; the card requires explicit configuration and warns of tradeoffs.", "sourceIds": ["qwen14-card"] },
        { "code": "NO_14B_FIT_ASSUMPTION", "rule": "Do not infer 14B fit from parameter count without artifact, KV, buffers and reserve calculations.", "sourceIds": ["llamacpp-docs"] }
      ],
      "disagreements": ["Partial CPU offload can make 14B load while violating the interactive preference."],
      "evaluationRule": "Expose the 7B baseline and retain 14B or explain its exact fit or latency exclusion."
    },
    {
      "id": "apple-16gb-writing-summarization", "status": "sourced-prior",